sector	area	policyRef	policyNumber	title	Text	DataIntro	DataTitle	DataLink	ReportIntro	ReportTitle	ReportLink	BriefIntro	BriefTitle	BriefLink
Industry	1	4-1	16	Scale-up research and development to create new low-carbon industrial processes	<p>The high temperatures needed for transforming raw materials into primary materials cannot be easily electrified and current alternatives are all expensive or technically difficult. Entirely new processes will need to be created to decarbonise heavy industry. The challenge for the industry is to scale up promising technologies so they can be widely used and commercially viable. Discovering these new low-carbon processes will take time, but governments can help by investing in R&D to catalyse innovation. </p> <p>Sweden is leading the way with two promising projects in cement and steel - the highest emitting sub-sectors in industry. The Swedish CemZero project is a pilot study on electrified cement production (which would be close to zero emissions if the electricity is fossil fuel free), and aims for zero carbon dioxide emissions by 2030. This would equal a 5% reduction of Sweden’s total CO<sub>2</sub> emissions. Likewise, the Swedish HYBRIT aims to create zero carbon steel across the supply chain - from the mining of iron ore to the fabrication of steel - using hydrogen technologies. </p> <p>The European Union is also investing heavily to push the innovation frontier. One of the missions for the Horizon 2020 funding is to strengthen the European value chain for low-carbon hydrogen and fuel cells for energy- and carbon-intensive industry, in particular the steel industry and the chemicals sector. </p>	ARTICLE:	Bioeconomy 101: Making Rubber Tyres From Dandelions, OECD Observer (2018)	https://www.oecdobserver.org/news/fullstory.php/aid/6035/Bioeconomy_101:_Making_rubber_tyres_from_dandelions.html	ARTICLE:	Mining and Green Growth in the EECCA Region OECD (2019)	https://dx.doi.org/10.1787/1926a45a-en	REPORT:	Regions in Industrial Transition: Policies for People and Places, OECD (2019)	https://dx.doi.org/10.1787/c76ec2a1-en
Industry	2	4-2	17	Regulate energy efficiency in plants to lower emissions  	<p>Heavy industry is highly energy-intensive. Transforming raw materials from the earth into primary materials - like steel, cement, aluminium, glass -requires very high temperatures. More effort is needed to find ways of reaching these temperatures without relying on fossil fuels like coal, but a good short-term alternative is to improve the energy efficiency of plants with strong or mandatory goals. </p> <p>Since 2009, Japan sets mandatory performance benchmarks for energy use from heavy industry plants to improve energy efficiency by 1% per year since 2009.  Russia has several laws in place which set federal and regional energy efficiency standards for industrial consumers, such as steel, aluminium, paper. These firms are required to submit energy efficiency and thermal efficiency performance certificates annually. Any plants that cannot meet these benchmarks are phased out. </p> <p>Alongside standards, the use of Energy Management Systems can also improve the overall efficiency of plants, thereby lowering energy consumption. Projections show that implementing <a href="https://www.iso.org/iso-50001-energy-management.html" target="_blank">ISO 50001</a>, a standard to encourage continual improvement, can lead to deep reductions in CO<sub>2</sub> emissions. </p>	REPORT:	Extended Producer Responsibility: Updated Guidance for Efficient Waste Management, OECD (2016) 	https://dx.doi.org/10.1787/9789264256385-en	REPORT:	The Macroeconomics of the Circular Economy Transition: A Critical Review of Modelling Approaches, OECD (2018) 	https://dx.doi.org/10.1787/af983f9a-en			
Industry	3	4-3	18	Price carbon while maintaining competitiveness to lower emissions and spur innovation	<p>The extraction and processing of materials and chemicals used in heavy industry - steel, cement, aluminium, glass, pulp and paper, and petrochemicals - generate high emissions that must be addressed. Carbon prices are often kept very low in order to maintain competitiveness, but carbon prices must rise, which means putting in place effective emissions trading schemes or carbon taxes amongst others. </p> <p>There are a number of ways to implement carbon pricing, so that it does not hurt firms’ competitiveness and, in turn, catalyses innovation. These include: setting a carbon price floor (preventing the carbon price from going too low to guarantee certain returns), international co-operation on carbon pricing for all countries or even co-operating globally to set a carbon price within a given industry - such as creating a carbon price for all cement firms globally. </p>	REPORT:	Carbon Pricing and Competitiveness: Are They at Odds? OECD (2019) 	https://dx.doi.org/10.1787/f79a75ab-en	REPORT:	The Joint Impact of the European Union Emissions Trading System on Carbon Emissions and Economic Performance OECD (2018)	https://dx.doi.org/10.1787/4819b016-en	REPORT:	Improving Economic Efficiency and Climate Mitigation Outcomes through International Co-ordination on Carbon Pricing OECD (2019)	https://dx.doi.org/10.1787/0ff894af-en
Industry	4	4-4	19	Lead the way for other economic sectors in shifting from linear to circular resource efficiency	<p>Our economies need to shift from being linear to circular. A linear economy is one that extracts resources, produces products, consumes them, and then disposes of them, creating a system of emissions and resource use. A circular economy creates a system that aims to keep products, components and materials in the economy for as long as possible, trying to eliminate waste and virgin resource inputs. This kind of system change requires using recycled secondary materials instead of virgin raw materials, designing products to be robust and repairable so they last longer, and using materials more efficiently, for example, through increased material productivity. </p><p>There are different tools for countries to incentivise this change - such as facilitating the trade of scrap materials, removing import bans - in addition to Extended Producer Responsibility requirements - holding producers responsible for products at the end of life, product take-back requirements, and advanced disposal fees. Product take-back requirements typically set recycling or collection targets for a given product or material, e.g., the European Union’s Waste Directive for Electronic Waste. Likewise, advance disposal fees (ADFs) are charged at the time of purchase, ideally, to cover the costs of collection and treatment of the product. When the ADF is transparent to the consumer, it may influence both consumer and manufacturer behaviour. </p>	INITIATIVE:	Re-circle - resource efficiency and circular economy (2019) 	https://www.oecd.org/environment/waste/recircle.htm	REPORT:	Extended Producer Responsibility: Updated Guidance for Efficient Waste Management, OECD (2016) 	https://dx.doi.org/10.1787/9789264256385-en	REPORT:	Policy Guidance on Resource Efficiency, OECD (2016)	https://dx.doi.org/10.1787/9789264257344-en
Industry	5	4-5	20	Educate for energy and resource efficient sustainable industrial practices 	<p>Educating actors across supply chains is fundamental for the transition to energy and resource efficiency. It helps unearth solutions, such as using waste from one industry as input in another. The United Kingdom’s Internal Synergies programme promotes such industrial symbiosis. Between 2005 and 2013, the United Kingdom’s National Industrial Symbiosis Programme was rolled out across all nine English regions and reduced CO<sub>2</sub> by 42 million tonnes, diverted 47 million tonnes of industrial waste from landfill, created over 10 000 jobs, and saved 60 million tonnes of virgin material, including 73 million tonnes of industrial water. The United Kingdom is now spreading its expertise, reaching 30 countries so far. </p><p>The European Union runs a European Resource Efficiency Knowledge Centre that offers a free self-assessment tool for small- and medium-sized firms working in 12 industries. SMEs answer questions on their consumption of energy, materials, water and waste, and the platform creates a personalised report with a set of actions for firms to be more efficient in these areas. </p><p>Other countries provide a consultancy. For example, France has a programme called Winning on All Counts led by an environmental and energy agency, the <a href="https://www.ademe.fr/" target=“_blank">ADEME</a>, for SMEs in industry to improve their resource efficiency, particularly targeting those with high energy and material consumption, with limited time and knowledge to undertake efficiency improvements. To fill this gap, the ADEME offers a coaching service to any SME willing to sign up. </p>	INITIATIVE:	Re-circle - resource efficiency and circular economy (2019) 	https://www.oecd.org/environment/waste/recircle.htm	REPORT:	Tackling Environmental Problems with the Help of Behavioural Insights, OECD (2017)	https://www.oecd.org/env/tackling-environmental-problems-with-the-help-of-behavioural-insights-9789264273887-en.htm			
Transport 	1	5-1	21	Scale-up research, production and use of zero-emission fuels	<p>Alternative fuels are the key to emissions-free transport, with electric mobility being the most advanced. In Norway, 46% of all new cars sold in 2018 were electric. Worldwide, 5.1 million electric cars were sold in 2018, up from 3.1 million in 2017. Still, they only make up about 0.5% of the global vehicle stock. Future uptake depends fundamentally on progress with battery technology to increase range, availability of charging infrastructure to reassure users, and ultimately on the price. The extent to which governments invest, and the range of incentives they put in place, will matter. </p> <p>It is unlikely that one single new energy source can replace oil for energy intensity. Government policy should act according to different technologies and uses. Electric mobility should be boosted to decarbonise urban traffic, for instance, which would slash emissions and improve air quality. Also, if flights under 1 000 kilometres used electric aircraft, this could save 15% of jet fuel. Hydrogen has advantages for longer ranges and where fast refuelling is necessary, for trucks or maritime transport for instance. Ships are also rediscovering wind power.  The use of biofuels and synthetic fuels should be stepped up as they allow conventional engines to run virtually carbon free, if sustainably produced. To boost this sector, Sweden now requires conventional fuels to be blended with biofuels to reduce the greenhouse gas emissions of diesel by 21% and of petrol by 4.2% by 2020. </p>	VIDEO:	10 Facts about Transport and Climate Change, International Transport Forum (2019)	https://www.youtube.com/channel/UCndtbdzClUoBVCBvteFwQaQ	REPORT:	ITF Transport Outlook 2019, International Transport Forum (2019)	https://www.oecd-ilibrary.org/transport/itf-transport-outlook-2019_transp_outlook-en-2019-en	POLICY BRIEF :	Is Low-Carbon Road Freight Possible? International Transport Forum (2018)	https://www.itf-oecd.org/low-carbon-road-freight
Transport 	2	5-2	22	Create conditions that increase accessibility and maximise use of transport capacity	<p>The average private car is used for just 50 minutes a day and carries 1.4 passengers. Studies show that car sharing can provide the same flexibility as private cars, but with just 10% fewer vehicles. That would reduce CO<sub>2</sub> emissions from cars by one third without introducing new technology. Because shared vehicles clock more miles, they are replaced more quickly and new low-carbon technologies hit the road faster. Public parking becomes redundant and the space can be used in more eco-friendly ways - for walking and cycling, or less polluting delivery of goods. Importantly, shared mobility services can act as feeders for public transport. The largest CO<sub>2</sub> reductions in the transport sector would come from shared electric vehicles.  </p><p>Moving goods is an ever more important part of transport. The share of freight will grow to nearly 50% of all transport activity by 2050, from just over a third today. Keeping down the associated CO<sub>2</sub> emissions will require better use of trucks and ships. Smart logistics solutions can help maximise capacity use - more efficient use of data, for instance, or sharing depots and delivery vans. Also, larger trucks or ships can move more freight with comparatively less energy. Still, care is needed to improve CO<sub>2</sub> efficiency along the entire supply chain. </p> <p>Governments should also strive to bring the costs of rail down to make it more competitive, modern and attractive for passengers, particularly on shorter national and transcontinental journeys, in Europe for instance. More investment should be channelled into new railways in developing countries and remote regions. </p>	VIDEO:	How Shared Self-driving Cars Could Change City Traffic, International Transport Forum (2015)  	https://youtu.be/j9kK0RHl-LI	INITIATIVE:	How Shared Mobility Can Make Cities More Liveable, International Transport Forum (2018)	https://www.itf-oecd.org/itf-work-shared-mobility	REPORT:	High Capacity Transport: Towards Efficient, Safe an Sustainable Road Freight, International Transport Forum (2019)	https://www.itf-oecd.org/high-capacity-transport
Transport 	3	5-3	23	Set prices to encourage sustainable passenger mobility and freight transport	<p>Transport relies on fossil fuels for over 94% of its energy. Zero- and low-carbon transport solutions will scale up only if they can compete on price. Road fuels are taxed relatively heavily - but not nearly to an extent that covers the cost of environmental harm. Preferential rates exist, too, for example for fuels used by trucks. Meanwhile international aviation and maritime fuels are not taxed at all.  </p> <p>Price signals are a powerful mechanism to steer citizens and businesses to choose less emitting forms of transport. Carbon prices can be set with different tools, notably direct taxes or emissions trading schemes. Purchase taxes on polluting vehicles and targeted subsidies can also help citizens and businesses buy into sustainable transport. Emissions and congestion charges on vehicles in cities have proved effective. Some have reduced local CO<sub>2</sub> emissions by around 15%. But road pricing should be fair and equitable. Revenues should be used in a transparent way and contribute to measures that effectively reduce CO<sub>2</sub> emissions Stockholm, for instance, introduced a congestion charge and invested the proceeds to expand its metro network. </p>	VIDEO:	10 Facts about Transport and Climate Change, International Transport Forum (2019)	https://www.youtube.com/channel/UCndtbdzClUoBVCBvteFwQaQ	ARTICLE:	The Long Flight Towards Clean Aviation, OECD Observer (2017)	https://www.oecdobserver.org/news/fullstory.php/aid/6016/The_long_flight_towards_clean_aviation.html	POLICY BRIEF :	How to Make Urban Mobility Clean and Green, International Transport Forum (2018)	https://eur02.safelinks.protection.outlook.com/?url=https%3A%2F%2Fwww.itf-oecd.org%2Furban-mobility-clean-green&data=02%7C01%7CFlora.MONSAINGEON-LAVURI%40oecd.org%7C0d7ab620dc5c4fcbb62a08d774e1b44a%7Cac41c7d41f61460db0f4fc925a2b471c%7C0%7C0%7C637106385052861983&sdata=r%2FDexP%2FdmM1GfqGVtTtQE19EKeaVulqGYHmTKCi9Q%2Bw%3D&reserved=0
Transport 	4	5-4	24	Make low-carbon transport the default for public sector decision making	<p>Governments should champion low- and zero-carbon transport and set an example for citizens and businesses. Investing in public transport, promoting walking and cycling, and providing good charging infrastructure are examples where public policy can make low-carbon transport the default and environmental sustainability the benchmark. Integrating transport planning with land-use policy and promoting urban densification will bring jobs, goods and services closer to people and  reduce the need for commuting. </p> <p>Public procurement provides another lever. Awarding contracts should take into account the carbon footprint of the bids. For instance, in Sweden, the tender for a ferry between Stockholm and the island of Gotland included greenhouse gas emissions as a criterion. The winning bid uses Liquefied Natural Gas (LNG), resulting in 20% lower CO<sub>2</sub> emissions. </p> <p>Governments operate large vehicle fleets. They should make the purchase of low- or zero-emission vehicles their default policy, which would send a strong political signal, not least to businesses that also have large fleets. </p>	VIDEO:	10 Facts about Transport and Climate Change, International Transport Forum (2019)	https://www.youtube.com/channel/UCndtbdzClUoBVCBvteFwQaQ	INITIATIVE:	The Global Policy Dialogue of the ITF Decarbonising Transport Initiative (2016)	https://www.itf-oecd.org/DT	POLICY BRIEF :	How to Better Reflect Transport in Climate Action Efforts, International Transport Forum (2018)	https://eur02.safelinks.protection.outlook.com/?url=https%3A%2F%2Fwww.itf-oecd.org%2Fclimate-action-efforts&data=02%7C01%7CFlora.MONSAINGEON-LAVURI%40oecd.org%7C0d7ab620dc5c4fcbb62a08d774e1b44a%7Cac41c7d41f61460db0f4fc925a2b471c%7C0%7C0%7C637106385052871977&sdata=zHr0l3j1ROY2tB5741bJ%2FNPJVpdQFag0%2FP1FCvwAGmU%3D&reserved=0
Transport 	5	5-5	25	Share knowledge about tested measures that reduce transport emissions	<p>A single invention to stop global heating is unlikely to be found. Doing what is already possible, on all fronts, by everyone, will be the most effective policy approach. More public-private co-operation nationally and internationally is necessary to create the conditions for the introduction and scaling up of decarbonisation measures as rapidly as possible. </p> <p>Effective interventions should be further deployed. These include operational measures like the “slow steaming” of freight ships, which reduces greenhouse gas emissions by 19% for a 10% reduction in speed, but can yield reduction up to 60%. Educational measures also work, for instance “eco-driving” training for truck drivers - fuel-efficient driving styles reduce trucks carbon emissions by up to 15%. Design improvements like air lubrication of ship hulls or weight optimisation in aircraft also save CO<sub>2</sub>. Streamlined customs procedures cut carbon, as trucks no longer have to inch forward for hours or even days at border points while emitting diesel fumes. Governments and businesses should intensify their collaboration to create pilot projects and test decarbonisation opportunities. </p>	VIDEO:	10 Facts about Transport and Climate Change, International Transport Forum (2019)	https://www.youtube.com/channel/UCndtbdzClUoBVCBvteFwQaQ	ARTICLE:	Adapting Transport to Climate Change and Extreme Weather, OECD Observer (2017)	https://www.oecdobserver.org/news/fullstory.php/aid/6159/An_uncertain_climate.html	REPORT:	Tackling Environmental Problems with the Help of Behavioural Insights, OECD (2017)	https://www.oecd.org/env/tackling-environmental-problems-with-the-help-of-behavioural-insights-9789264273887-en.ht